{
  "schemaVersion": 1,
  "ensembleId": "cgb001-ws4-response-ensemble-v1",
  "modelId": "nintendo-cgb-001-period-reconstruction",
  "classification": "period-reconstructed",
  "evidenceIds": [
    "CGB-SHARP-HRTFT-1997",
    "CGB-SHARP-REFLECTIVE-1999",
    "CGB-TN-SEKIYA-2001",
    "CGB-HCS-REFLECTANCE-2026",
    "CGB-PRIOR-LIBRETRO"
  ],
  "referenceTemperatureC": {
    "value": 25,
    "units": "degrees Celsius",
    "classification": "generic-laboratory-reference-only",
    "runtimeCoefficientAvailable": false
  },
  "stateDefinition": {
    "coordinate": "per-channel continuous source-command coordinate",
    "range": [
      0,
      1
    ],
    "units": "dimensionless; not volts and not final luminance",
    "codeMapping": "code5 / 31",
    "endpointPolicy": "state==target is exact; residual below 1/65536 snaps exactly to the target",
    "colorBoundary": "evaluate exact settled coordinates through the unchanged WS1 32-cubed D65 LUT"
  },
  "responseDefinition": {
    "runtimeDefinition": "project-equivalent 10-to-90 interval",
    "sourceDefinition": "Sharp Table 2 labels only 'on and off' and 'gray scales'; no threshold, direction, gray pair, temperature, or waveform is supplied.",
    "conversionStatus": "period-reconstructed-conversion",
    "equation": "t10to90 = ln(9) / rate",
    "fullScaleReference": "code 0 to 31 and 31 to 0 use the on-and-off anchor symmetrically",
    "grayReference": "adjacent middle transitions 15 to 16 and 16 to 15 use the gray-scales anchor symmetrically"
  },
  "selectedModel": {
    "candidateId": "symmetric-first-order-rate-field",
    "equationId": "CGB-WS4-FIRST-ORDER-RATE-FIELD-V1",
    "stateEquation": "xNext = target + (x - target) * exp(-rate * dt)",
    "rateEquation": {
      "distance": "abs(toCode - fromCode) / 31",
      "grayWeight": "clamp(((1 - distance) / (30 / 31))^2, 0, 1)",
      "t10To90Milliseconds": "onOffMs + (grayMs - onOffMs) * grayWeight",
      "identityCell": "uses grayMs as a replaceable table value; the exact state==target fixed point bypasses rate evaluation",
      "classification": "period-reconstructed-continuous-reduction"
    },
    "snapEpsilon": 0.0000152587890625,
    "modelSelectionReason": "Smallest causal model that matches all accepted scalar compatibility anchors; table rates remain replaceable by future measurements."
  },
  "members": [
    {
      "id": "hcr-like-fast",
      "role": "fast",
      "classification": "manufacturer-family-bound",
      "familyInterpretation": "HCR-like endpoint; does not assert that the CGB is HCR",
      "parameters": {
        "onAndOffT10To90Milliseconds": 50,
        "grayT10To90Milliseconds": 80
      },
      "evidenceIds": [
        "CGB-SHARP-HRTFT-1997"
      ],
      "uncertainty": "Source response definition and relationship to CGB are unknown."
    },
    {
      "id": "mid-envelope-nominal",
      "role": "nominal",
      "classification": "period-reconstructed-mid-envelope",
      "familyInterpretation": "arithmetic midpoint between the HCR-like and GH-like family bounds; not a measured typical CGB",
      "parameters": {
        "onAndOffT10To90Milliseconds": 65,
        "grayT10To90Milliseconds": 115
      },
      "evidenceIds": [
        "CGB-SHARP-HRTFT-1997"
      ],
      "uncertainty": "Chosen only as a neutral period midpoint until CGB-specific data exists."
    },
    {
      "id": "gh-like-slow",
      "role": "slow",
      "classification": "manufacturer-family-bound",
      "familyInterpretation": "GH-like endpoint; does not assert that the CGB is GH",
      "parameters": {
        "onAndOffT10To90Milliseconds": 80,
        "grayT10To90Milliseconds": 150
      },
      "evidenceIds": [
        "CGB-SHARP-HRTFT-1997"
      ],
      "uncertainty": "Source response definition and relationship to CGB are unknown."
    }
  ],
  "uncertaintyDimensions": {
    "channel": {
      "r": 1,
      "g": 1,
      "b": 1,
      "classification": "unresolved-held-neutral"
    },
    "temperature": {
      "value": 25,
      "units": "degrees Celsius",
      "classification": "generic-laboratory-reference-only",
      "runtimeCoefficientAvailable": false
    },
    "direction": {
      "selected": false,
      "classification": "unresolved-held-symmetric"
    },
    "waveform": "Sharp family source has no waveform; first-order is the minimum selected shape",
    "exactCgbPanel": "no accepted CGB-specific response data",
    "overshoot": {
      "selected": false,
      "classification": "unsupported"
    },
    "retention": {
      "selected": false,
      "classification": "separate-WS7-state"
    }
  },
  "specimenOverrideContract": {
    "status": "interface-frozen-no-measured-overrides",
    "addressing": "ensembleMember/channel/fromCode/toCode",
    "fields": [
      "ratePerSecond",
      "sourceWaveformId",
      "temperatureC",
      "responseDefinition",
      "uncertainty"
    ],
    "replacementRule": "A valid measured cell replaces only the addressed rate and provenance; invalid or absent cells retain the reconstructed rate.",
    "shaderInterfaceChangesRequired": false,
    "currentMeasuredCellCount": 0
  },
  "runtimeArtifact": {
    "path": "../generated/cgb001-ws4-gtg-rates-v1.r32f",
    "descriptor": "../generated/cgb001-ws4-gtg-rates-v1.json",
    "sha256": "a43e901fbb103c578d1b26263057148d9ab8524507b5d826309879e50fb0ecf9",
    "format": "little-endian R32_SFLOAT",
    "dimensions": [
      3,
      3,
      32,
      32
    ],
    "equationRevision": "CGB-WS4-FIRST-ORDER-RATE-FIELD-V1"
  },
  "validation": {
    "status": "pass",
    "cpuFutureShaderTolerance": 2e-7,
    "modelSelectionReport": "../generated/ws4-model-selection-v1.json",
    "equationReport": "../generated/ws4-equation-vectors-v1.json",
    "motionFixtureReport": "../generated/ws4-motion-fixtures-v1.json",
    "generatedCellCount": 9216,
    "measuredOverrideCellCount": 0,
    "maximumFramesToExactTarget": 34,
    "ws1StaticColorDifference": 0,
    "actualGpuReadback": false
  }
}
